Domain,Estimated Traffic,Top Ranking Keywords,Domain Authority (Est),Niche Focus
billetbadges.com,Medium,"custom billet badges, custom chevy emblems",42,High-end CNC Billet Aluminum
autobadges.com,Medium,"custom car badges, billet emblems",38,CNC Machined Billet Aluminum
royaltycore.com,High,"custom truck grilles, stainless steel emblems",45,Industrial Stainless Steel Grilles/Emblems
maineventemblems.com,Medium,"custom aluminum badges, truck emblems",35,Powder Coated Aluminum/Stainless
forgedconcepts.org,Low,"custom fender badges, custom car accessories",28,Specialized Fender/Interior Badges
tso.co,Medium,"laser cut emblems, truck builds",32,Laser-cut Powder Coated Steel
boss-fab.com,Low,"square body emblems, lsx badges",25,Classic/Restomod Truck Emblems
