Conversational Query,Primary Entity,Intent,Target Content Type,Target Page
"What is the most durable way to black out my Silverado emblems?",Silverado Emblems,Commercial/Informational,Blog / Answer Capsule,/articles
"Are engraved emblems better than vinyl overlays for trucks?",Engraved vs Vinyl,Comparison,Blog / Comparison Table,/glossary
"How long do hand-etched automotive engravings last?",Durability,Informational,FAQ / Answer Capsule,/glossary
"Best custom chevy badges for 2024 Silverado High Country",2024 Silverado,Transactional,Product Collection,/products?make=Chevrolet
"Where can I get custom hand-etched emblems in the USA?",Engraving Nation,Navigational/Local,LocalBusiness Page,/
"Can you engrave custom designs on mirror caps?",Mirror Caps,Transactional,Service Page / FAQ,/services
"Custom truck emblem engraving services near Hauppauge NY",Local Service,Local,LocalBusiness Page,/
"Engraving Nation vs Billet Badges: Which is better for custom work?",Comparison,Commercial,Comparison Page,/glossary
"How to install a replacement grille emblem on GMC Sierra?",Installation,Informational,Guide / Video,/articles
"Do custom engraved emblems void my vehicle warranty?",Warranty,Informational,FAQ,/glossary
"What materials are used for Engraving Nation emblems?",Materials,Informational,Glossary,/glossary
